{
  "schema_version": "0.3.0",
  "project_id": "NINEL",
  "unit_id": "NINEL-E01",
  "source_event_ids": [
    "NINEL-EV001"
  ],
  "scene_mappings": [
    {
      "scene_id": "NINEL-E01-SC001",
      "heading": "INT. MEDICAL BAY - NIGHT",
      "event_ids": [
        "NINEL-EV001"
      ],
      "character_ids": [
        "NINEL-CH001",
        "NINEL-CH002"
      ],
      "location_id": "NINEL-LO001",
      "objective": "Understand the awakening.",
      "conflict": "Argo provides incomplete context.",
      "turn": "Ninel asks about her return."
    }
  ],
  "character_mappings": [
    {
      "character_id": "NINEL-CH001",
      "cue": "NINEL"
    },
    {
      "character_id": "NINEL-CH002",
      "cue": "ARGO"
    }
  ],
  "location_mappings": [
    {
      "location_id": "NINEL-LO001",
      "name": "Medical bay"
    }
  ],
  "setup_payoffs": [],
  "assumptions": [],
  "uncertainties": []
}
